id,country,ccode,year,region,protest,protestnumber,startday,startmonth,startyear,endday,endmonth,endyear,protesterviolence,location,participants_category,participants,protesteridentity,protesterdemand1,protesterdemand2,protesterdemand3,protesterdemand4,stateresponse1,stateresponse2,stateresponse3,stateresponse4,stateresponse5,stateresponse6,stateresponse7,sources,notes
1402015022,Brazil,140,2015,South America,1,22,16,11,2015,16,12,2015,0,states of S  o Paulo & Goias,50-99,>50,students,"political behavior, process",,,,crowd dispersal,ignore,accomodation,crowd dispersal,,,.,"brazil s students demand to be heard. the new york times, december 16, 2015 wednesday, section ; column 0; oped; op ed contributor; by pablo ortellado. pablo ortellado is a fellow at the open society foundations and a professor of public policy and management at the university of s o paulo.;","exact dates unclear. there are two previous protests but no details on size. start date reflects when 100 schools were occupied, end date is once 200 schools were occupied. it s another crisis in the state of s o paulo that has the potential to shape democracy in the country for years to come. that s because this crisis a huge protest in response to the state s plan to close 94 public schools involves some of the country s youngest citizens: elementary, middle and high school students. in october, without discussing the decision with teachers, parents or students, the s o paulo state government announced during a television interview that dozens of schools would be closed next year...the response to the announcement was immediate. first, the teachers union organized protests, but they were ignored. then, students protested in their neighborhoods, hoping to raise awareness among community members. they were ignored. finally, on nov. 9, a handful of students decided to occupy a school in the metropolitan area of s o paulo. within a week, nearly 100 schools had been occupied, and, a week later, 200...although they enjoy broad support from parents, neighbors, teachers and the wider community, the students have faced tough resistance from the state government. initially, the state tried to have the police remove the students by force, but that effort was quashed by the judiciary, which suggested that the government sit down with the protesters to negotiate a solution. so far that has not happened...thousands of students are now living in their occupied schools in s o paulo. in the face of the government s declaration of war, they are organizing classes, workshops and musical performances, cooking for one another with food donated by parents and neighbors, and handling routine maintenance on the buildings they have taken over. rather than losing strength, they are expanding their demands. they are no longer fighting just to keep their schools open. now, their protest has become a way to express their dissatisfaction with the school system in general...last week, officials of the state government said they would postpone the school closings for one year. the education secretary has resigned. still, the government continues to take aggressive action last week large public demonstrations were met with riot police. although the protesters now occupy only 100 schools, they show no signs of backing down. in fact, their movement appears to be contagious. students in another state, goias, have so far taken over nine buildings to protest a decision turning over management of their schools to private nonprofits..."
1402015023,Brazil,140,2015,South America,1,23,13,12,2015,13,12,2015,0,nationwide,>10000,10000s,protesters,removal of politician,,,,ignore,,,,,,.,"1 protests continue against brazilian president. the new york times, december 14, 2015 monday, section a; column 0; foreign desk; pg. 6, by simon romero; mariana sim es contributed reporting from rio de janeiro, and paula moura from s o paulo; 2 thousands protest corruption in brazil. the washington post, december 14, 2015 monday, a section; pg. a08, dom phillips;","1 thousands of protesters took to the streets again across brazil on sunday to demand the ouster of president dilma rousseff, who faces impeachment proceedings that could drag on for months while her government struggles to lift the economy from its most severe crisis in decades. the protests appeared to be smaller than earlier demonstrations calling for her ouster, perhaps offering some comfort to the beleaguered president. even so, the vitriol expressed by many protesters, including calls by some for the armed forces to remove ms. rousseff, reflect the increasing polarization in the country that is making it harder for her to govern... ; 2 tens of thousands of brazilians protested corruption and called for the impeachment of president dilma rousseff in demonstrations across the country sunday. but the numbers were down from nationwide protests staged three times earlier this year...in s o paulo, 40,000 people marched, down from 135,000 in august, the datafolha polling firm said. numbers in rio appeared significantly less than the 100,000 that organizers claimed attended a demonstration in march. there were protests sunday in all 26 states and the capital, brasilia..."
1402016001,Brazil,140,2016,South America,1,1,8,1,2016,8,1,2016,1,"S o Paulo, Rio de Janeiro and Belo Horizonte",1000-1999,>1000,protesters,"price increases, tax policy",,,,crowd dispersal,arrests,,,,,,"the americas; brazil: protests over higher bus fares erupt in 3 cities, the new york times, january 9, 2016 saturday, section a; column 0; foreign desk; world briefing; pg. 5, 120 words, by simon romero;","protests flared in the cities of s o paulo, rio de janeiro and belo horizonte on friday night over increases in bus fares, reflecting resentment over efforts by the municipal authorities to cover budget shortfalls during brazil s most severe economic crisis in decades. anti riot police units clashed with protesters in downtown s o paulo. the unrest drew comparisons to the much larger demonstrations that shook cities across brazil in 2013, which also crystallized over increases in bus fares. some of the demonstrators in s o paulo destroyed buses, ransacked banking offices and threw rocks and bottles at the police, who used tear gas. clashes also erupted between the police and protesters in downtown rio de janeiro."
1402016002,Brazil,140,2016,South America,1,2,12,1,2016,12,1,2016,0,"Avenida Paulista, S o Paulo",100-999,25 protesters injured,movimento passe livre,"price increases, tax policy",,,,crowd dispersal,arrests,,,,,,"protests resume in s o paulo, the new york times, january 13, 2016 wednesday, section a; column 0; foreign desk; pg. 7, 214 words, by vinod sreeharsha;","demonstrators in brazil s financial capital, s o paulo, took to the streets again on tuesday, protesting an increase in bus and transit fares amid a prolonged nationwide recession. the military police fired tear gas and used stun grenades to disperse the mostly peaceful crowd, continuing the aggressive tactics they have used since protests began in 2013. at least 25 protesters were injured and taken to a nearby hospital, according to the brazilian newspaper folha de s. paulo. protesters gathered on avenida paulista, one of the city s main thoroughfares. the group movimento passe livre organized tuesday s protests. it was also a catalyst for the 2013 protests that gripped the nation. protesters held signs that said 3.80 n o pago, or i won t pay 3.80, which is the new fare, up from 3.50 reals, or about 86 cents. the increase is backed by s o paulo s mayor, fernando haddad, and the state s governor, geraldo alckmin. mr. haddad belongs to the beleaguered governing party, but mr. alckmin is a leader of the opposition party, and his popularity has also fallen. the protests tuesday resulted in little of the vandalism that accompanied protests in december. folha de s. paulo reported that the police had arrested at least eight people tuesday."
1402016003,Brazil,140,2016,South America,1,3,13,3,2016,13,3,2016,0,S o Paulo; Rio de Janeiro; national,>10000,hundreds of thousands to 1.4 million,anti government,removal of politician,"political behavior, process",,,ignore,,,,,,,"1. demands for change hit streets in brazil, the new york times, march 14, 2016 monday, section a; column 0; foreign desk; pg. 9, 759 words, by simon romero; 2. president faces impeachment trial, the times london , march 15, 2016 tuesday, news; pg. 33, 240 words, james hider; 3. top cabinet post for ex president ignites a fury in brazil, the washington post, march 18, 2016 friday, a section; pg. a15, 968 words, dom phillips.;","protesters in cities across brazil called for the ouster of president dilma rousseff on sunday, reflecting rising anger in the country over huge corruption scandals and a deepening economic crisis. it was the fifth time in the past year that groups had mobilized large numbers of demonstrators thousands both here and in s o paulo for protests in the streets against the governing leftist workers party. the movement regained momentum this month after investigators targeted luiz in cio lula da silva, the influential former president, who picked ms. rousseff as his successor. more than 500,000 people were at the protest in s o paulo, according to the datafolha polling company, ranking it among the largest since the end of military rule in the 1980s. about 1.4 million people took to the streets in cities across brazil yesterday to demand the president s removal from power. she stands accused of manipulating federal accounts to make the economy appear healthier than it was before the 2014 elections, which she narrowly won."
1402016004,Brazil,140,2016,South America,1,4,16,3,2016,18,3,2016,0,Bras lia; S o Paulo; Brazil s National Congress; national,>10000,tens of thousands,anti government,removal of politician,"political behavior, process",,,crowd dispersal,,,,,,,"1. amid scandal, brazil s leader gives predecessor legal shield, the new york times, march 17, 2016 thursday, section a; column 0; foreign desk; pg. 1, 1479 words, by simon romero; 2. top cabinet post for ex president ignites a fury in brazil, the washington post, march 18, 2016 friday, a section; pg. a15, 968 words, dom phillips;","ms. rousseff is battling to stay in office, with protesters demanding her ouster and lawmakers pursuing impeachment proceedings against her. demonstrations calling for her to resign flared wednesday night in cities including bras lia and s o paulo. police broke up fights between opposing groups of demonstrators outside brazil s national congress building and protests flared in other cities thursday as the country descended into political chaos amid a standoff between the judiciary and the government. the anti government protests were provoked by president dilma rousseff s decision to give her predecessor luiz in cio lula da silva a top cabinet post a move that sent tens of thousands of brazilians onto streets nationwide wednesday night. as lula was sworn in thursday morning, there were protests in at least 15 states, the g1 news site reported. there were protests wednesday night in at least 18 brazilian states, according to the g1 news site. various cities also saw episodes of protesters banging pots and blaring car horns."
1402016005,Brazil,140,2016,South America,1,5,18,3,2016,18,3,2016,0,national,>10000,tens of thousands,pro government supporters,"political behavior, process",,,,crowd dispersal,,,,,,,"1. supporters of brazil s embattled government fill streets, the washington post, march 20, 2016 sunday, a section; pg. a08, 639 words, dom phillips; 2. riots over brazil corruption scandal, the times london , march 19, 2016 saturday, news; pg. 37, 349 words, james hider.;","rallies come after days of protests against president, predecessor sao paulo, brazil with brazil s president and her predecessor embroiled in a growing corruption scandal, supporters of the governing workers party took to the streets in defiant rallies friday. pro government protesters rallied in 20 of brazil s 26 states on friday, with anti government demonstrations staged in eight states. in sao paulo, tens of thousands of government supporters had flooded the streets by 6 p.m. on thursday night, riot police used stun grenades and tear gas on about 8,000 protesters outside the national congress in brasilia, the capital. i want impeachment and all the bandits out of government, said daniela figueiredo, 34, who was among thousands taking part in an anti government protest that began wednesday on sao paulo s landmark paulista avenue. on friday morning, police used water cannons to clear figueiredo and other protesters off the street to make way for the pro government rally. while red shirted party supporters waved flags, riot police with armored trucks waited in nearby side streets."
1402016006,Brazil,140,2016,South America,1,6,17,4,2016,17,4,2016,0,Brasilia; national,>10000,25000,pro government supporters,"political behavior, process",,,,crowd dispersal,,,,,,,"1. ouster of brazil leader looms, the washington post, april 18, 2016 monday, a section; pg. a01, 1189 words, dom phillips;nick miroff; 2. protests grip brazil as rousseff faces impeachment defeat, the times london , april 18, 2016 monday, news; pg. 29, 548 words, james hider.;","president dilma rousseff lost a crucial impeachment vote in brazil s lower house on sunday evening, making her removal ever more likely and deepening the country s political crisis less than four months before the opening ceremony of the summer olympics in rio de janeiro. demonstrators on both sides of brazil s political divide held rallies and street protests here and nationwide sunday. many followed the voting in congress on big screens as if watching a soccer match. according to police estimates, the crowd of more than 50,000 impeachment supporters at a rally sunday outside congress was twice as large as the anti impeachment group that marched through brasilia in rousseff s defense. those demonstrators have camped out near a soccer stadium here in the capital, many of them from activist groups, unions and left wing movements that belong to rousseff s coalition. maria da silva, 47, traveled from maceio, in northeastern brazil, where she works for the bus drivers trade union. she said the lives of tens of millions of poorer brazilians like her improved immeasurably under workers party governments."
1402016007,Brazil,140,2016,South America,1,7,17,4,2016,17,4,2016,0,Brasilia; national,>10000,50000,anti government,removal of politician,,,,crowd dispersal,,,,,,,"1. ouster of brazil leader looms, the washington post, april 18, 2016 monday, a section; pg. a01, 1189 words, dom phillips;nick miroff; 2. protests grip brazil as rousseff faces impeachment defeat, the times london , april 18, 2016 monday, news; pg. 29, 548 words, james hider.;","president dilma rousseff lost a crucial impeachment vote in brazil s lower house on sunday evening, making her removal ever more likely and deepening the country s political crisis less than four months before the opening ceremony of the summer olympics in rio de janeiro. demonstrators on both sides of brazil s political divide held rallies and street protests here and nationwide sunday. many followed the voting in congress on big screens as if watching a soccer match. according to police estimates, the crowd of more than 50,000 impeachment supporters at a rally sunday outside congress was twice as large as the anti impeachment group that marched through brasilia in rousseff s defense. those demonstrators have camped out near a soccer stadium here in the capital, many of them from activist groups, unions and left wing movements that belong to rousseff s coalition. maria da silva, 47, traveled from maceio, in northeastern brazil, where she works for the bus drivers trade union. she said the lives of tens of millions of poorer brazilians like her improved immeasurably under workers party governments."
1402016008,Brazil,140,2016,South America,1,8,3,5,2016,3,5,2016,0,Brasilia,50-99,scores,pro government supporters,"political behavior, process",,,,ignore,,,,,,,"olympic torch barred by protesters, the times london , may 4, 2016 wednesday, news; pg. 36, 113 words;","supporters of president rousseff tried to halt the progress of the olympic torch as it arrived in brazil yesterday in protest at what they are calling a coup d tat against the socialist head of state. scores of protesters shouting coup mongers and fascists ran at police lines along the torch s route to the capital but did not break through. ms rousseff faces impeachment over claims that she juggled figures before the 2014 election to make her government s economic performance look better than it was. it is thought likely that michel temer, her vice president, will take over in time to open the games on august 5."
1402016009,Brazil,140,2016,South America,1,9,12,5,2016,12,5,2016,0,"Presidential Palace, Brasilia",100-999,hundreds,pro government supporters,"political behavior, process",,,,ignore,,,,,,,"the end of an era in brazil?, the washington post, may 13, 2016 friday, a section; pg. a10, 1202 words, dom phillips;nick miroff.;","brazil s once lauded model of leftist government appeared to come to an abrupt end thursday, when lawmakers suspended president dilma rousseff in an extraordinary repudiation of her administration and the workers party that has ruled the country for 13 years. rousseff s supporters called for strikes and demonstrations blocking roadways, but the sympathizers who gathered at the presidential palace thursday appeared to number only in the hundreds."
1402016010,Brazil,140,2016,South America,1,10,15,5,2016,13,7,2016,0,Rio de Janeiro,50-99,more than a dozen schools,teachers and students,labor wage dispute,"political behavior, process",,,ignore,,,,,,,"1. party pledging brazil salvation made rio crisis, the new york times, may 23, 2016 monday, section a; column 0; foreign desk; pg. 1, 1589 words, by simon romero; 2. cash strapped rio says olympics will be fine, the washington post, july 13, 2016 wednesday, a section; pg. a10, 1289 words, dom phillips;","students are taking over rio de janeiro schools to protest crippling education cuts, while the politician who helped bring the summer olympics to this city is battling allegations that he pocketed millions in bribes. rio s leaders say the fiscal crisis has forced them to delay pension payments to retired state employees. the education budget was slashed, prompting teachers to strike and high school students to occupy more than a dozen schools to protest deplorable conditions."
1402016011,Brazil,140,2016,South America,1,11,15,5,2016,23,5,2016,0,national,100-999,>100,artists; musicians; actors,removal of politician,labor wage dispute,,,ignore,,,,,,,"in brazil, dissension takes artful turn, the washington post, may 23, 2016 monday, a section; pg. a08, 860 words, dom phillips;","musicians lead protests after president s move to eliminate culture agency rio de janeiro artists, producers and actors are occupying public buildings across brazil to protest the new government of interim president michel temer. musicians railed against temer at shows across brazil this weekend, and their audiences sang for his ouster. some chanted temer out to a famous and melodramatic opera melody its sense of impending apocalypse playing with unfounded internet rumors that brazil s unpopular new leader is a satanist. the occupations were sparked by temer s cost cutting move to ax brazil s ministry of culture and have fanned the flames of a cultural revolt. they came on the heels of a silent protest by brazilian actors and director kleber mendon a filho at the cannes film festival in france, as well as anti impeachment declarations by other famous brazilians, among them wagner moura, star of the netflix series narcos. the artistic movement has galvanized producers, musicians, actors and artists and is especially dangerous for temer because it was spontaneously organized by the creative community, not rousseff s workers party. on friday singer caetano veloso performed a free show for thousands outside the landmark ministry of culture building in rio that is occupied by protesters. the crowd turned one of his classics into a sing along of i hate michel temer. earlier, another crowd there sang temer out to a melody from carl orff s opera, carmina burana during an orchestral concert. other temer out chants were also heard at free concerts by major brazilian artists such as ney matogrosso in sao paulo on saturday night, and temer never flashed on a screen during sunday s performance by rapper criolo."
1402016012,Brazil,140,2016,South America,1,12,27,5,2016,29,5,2016,0,Rio de Janeiro; Sao Paulo; Recife,5000-10000,thousands,women; feminists,"political behavior, process",,,,crowd dispersal,ignore,,,,,,"1. mixed reaction to rape says a lot about brazil, the washington post, may 31, 2016 tuesday, a section; pg. a09, 666 words, dom phillips; 2. first arrest made after gang rape of teenager in brazil, the new york times, may 29, 2016 sunday, section a; column 0; foreign desk; pg. 10, 447 words, by christopher mele;","brazil is still in shock after the highly publicized gang rape of a 16 year old girl. but while thousands of people have taken to the streets to protest the rape and many more have protested on social networks, there also has been a counterreaction. when news of the teenager s rape began spreading across the internet, outrage was widespread. thousands of women took to the streets of rio, sao paulo and recife to protest the attack and what they called a culture supportive of rape. it is frightening. it is sad, disappointing and revolting, said flavia medeiros, 27, who participated in a demonstration in rio on friday. one of the biggest problems in brazilian society is the way women are treated. many of the protesters are part of an increasingly active and vocal feminist movement that has used the internet to communicate, coordinate and protest. in the capital, brasilia, police used pepper spray sunday morning on female demonstrators outside the supreme court."
1402016013,Brazil,140,2016,South America,1,13,4,7,2016,4,7,2016,0,"Rio international airport, Rio de Janeiro",50-99,>50,police & firefighters,labor wage dispute,,,,ignore,,,,,,,"1. anger rises in rio as videos draw attention to a surge in violence, the washington post, july 6, 2016 wednesday, a section; pg. a11, 692 words, dom phillips; 2. hoping for games glory, rio residents still vaulting local hurdles, the christian science monitor, july 22, 2016 friday, world, 865 words, whitney eulich.;","a month before rio de janeiro hosts south america s first olympic games, two cellphone videos have brought home the grim reality of rising violence in the city s teeming favelas the poor communities that are home to almost a quarter of rio s population. in one clip, small children cower in fear in a cable car gondola while a gunfight rages below at 4 o clock on a monday afternoon. the clip hit the internet the same day that mayor eduardo paes told cnn that the state government is doing a terrible job with security. by monday night, the video was on the front page of brazil s biggest news site, the globo network s g1. that morning, police and firefighters had organized a protest at rio s international airport over violence and unpaid salaries. welcome to hell, a banner read. police and firefighters don t get paid, whoever comes to rio de janeiro will not be safe. it was their second demonstration at the airport, through which olympic participants and visitors will pass."
1402016014,Brazil,140,2016,South America,1,14,29,7,2016,29,7,2016,0,"Copacabana, Rio de Janeiro",100-999,hundreds,anti government,removal of politician,"political behavior, process",,,ignore,,,,,,,"athletes kit snatched after fire at village, the times london , august 2, 2016 tuesday, sport; pg. 17, 584 words, james hider;","as the city prepared for the opening ceremony on friday hundreds of demonstrators gathered in copacabana to protest against dilma rousseff, the suspended president who will face an impeachment trial during the games, and against her predecessor luiz in cio lula da silva, who is to stand trial on charges of obstructing the course of justice in a corruption scandal that has rocked the country. thousands of people turned out in other cities to support the two left wing leaders, potentially setting the stage for unrest."
1402016015,Brazil,140,2016,South America,1,15,29,7,2016,29,7,2016,0,national,2000-4999,thousands,pro government supporters,"political behavior, process",,,,ignore,,,,,,,"athletes kit snatched after fire at village, the times london , august 2, 2016 tuesday, sport; pg. 17, 584 words, james hider;","as the city prepared for the opening ceremony on friday hundreds of demonstrators gathered in copacabana to protest against dilma rousseff, the suspended president who will face an impeachment trial during the games, and against her predecessor luiz in cio lula da silva, who is to stand trial on charges of obstructing the course of justice in a corruption scandal that has rocked the country. thousands of people turned out in other cities to support the two left wing leaders, potentially setting the stage for unrest."
